{
  "$schema": "https://json-schema.org/draft/2020-12/schema",
  "$id": "https://bit-physics.local/schemas/capture-v1.json",
  "title": "Bit-Physics Capture Manifest",
  "description": "Canonical capture-manifest schema (spec § 2.7). schema_version is initially 1.0.0; bumps governed by spec § 2.12 (Phase 4 WU-A only).",
  "type": "object",
  "additionalProperties": false,
  "required": [
    "schema_version",
    "sim",
    "stack",
    "config",
    "run",
    "payload",
    "determinism"
  ],
  "properties": {
    "schema_version": {
      "type": "string",
      "pattern": "^\\d+\\.\\d+\\.\\d+$",
      "description": "Semantic version of this capture schema."
    },
    "sim": {
      "type": "object",
      "additionalProperties": false,
      "required": ["name", "category", "variant"],
      "properties": {
        "name":     { "type": "string", "minLength": 1 },
        "category": { "type": "string", "minLength": 1 },
        "variant":  { "type": "string", "minLength": 1 }
      }
    },
    "stack": {
      "type": "object",
      "additionalProperties": false,
      "required": ["name", "version", "build_id"],
      "properties": {
        "name":     { "type": "string", "minLength": 1 },
        "version":  { "type": "string", "minLength": 1 },
        "build_id": { "type": "string", "minLength": 1 }
      }
    },
    "config": {
      "type": "object",
      "additionalProperties": false,
      "required": ["tier", "dims", "dtype", "seed", "params"],
      "properties": {
        "tier":  { "type": "string", "minLength": 1 },
        "dims":  {
          "type": "array",
          "items": { "type": "integer", "minimum": 1 },
          "minItems": 1
        },
        "dtype": { "type": "string", "enum": ["f32", "f64"] },
        "seed":  { "type": "integer" },
        "params": { "type": "object" }
      }
    },
    "run": {
      "type": "object",
      "additionalProperties": false,
      "required": [
        "step_count", "capture_interval", "wall_clock_seconds", "start_utc"
      ],
      "properties": {
        "step_count":         { "type": "integer", "minimum": 0 },
        "capture_interval":   { "type": "integer", "minimum": 1 },
        "wall_clock_seconds": { "type": "number",  "minimum": 0 },
        "start_utc":          { "type": "string", "minLength": 1 }
      }
    },
    "payload": {
      "type": "object",
      "additionalProperties": false,
      "required": ["format", "path", "checksum"],
      "properties": {
        "format":   { "type": "string", "enum": ["hdf5"] },
        "path":     { "type": "string", "minLength": 1 },
        "checksum": {
          "type": "string",
          "pattern": "^sha256:[0-9a-f]{64}$",
          "description": "Raw-file sha256 of the HDF5 payload as written by the producer. INFORMATIONAL only — the canonical determinism contract lives at the spec § 2.5 harness, not at this field. Storage-format metadata (HDF5 object-header timestamps, etc.) may vary across writes at different Unix instants even when the underlying state is identical; consumers MUST NOT use payload.checksum byte-equality as the determinism gate. Use tools/testkit/determinism::run_twice_and_diff (Python) or @bit-physics/common-ts::runTwiceAndDiff (TypeScript) instead."
        }
      }
    },
    "determinism": {
      "type": "object",
      "additionalProperties": false,
      "required": ["claimed", "atomic_ops", "subgroup_ops"],
      "properties": {
        "claimed": {
          "type": "string",
          "enum": ["bit-exact-same-hw", "epsilon", "non-deterministic"],
          "description": "Per-sim determinism posture per spec § 2.5 + § 2.6. The enum value `bit-exact-same-hw` denotes the content-equivalent contract defined at spec § 2.5: every state array and diagnostic entry in the canonical Capture is exactly element-wise equal across two runs at the same seed on the same hardware (storage-format metadata excluded). The enum value name is preserved for backward compatibility with pre-sub-phase-capture-determinism-contract manifests; the semantics are the content-equivalent contract."
        },
        "atomic_ops":   { "type": "boolean" },
        "subgroup_ops": { "type": "boolean" }
      }
    }
  }
}
