{
  "config": {
    "dims": [
      8,
      8,
      3
    ],
    "dtype": "f64",
    "params": {
      "bend_compliance": 1e-05,
      "dt": 0.016666666666666666,
      "gravity": [
        0.0,
        -9.81,
        3.0
      ],
      "iterations": 20,
      "nx": 8,
      "ny": 8,
      "spacing": 1.0,
      "stretch_compliance": 1e-07,
      "substeps": 1,
      "velocity_damping": 0.0
    },
    "seed": 42,
    "tier": "ref"
  },
  "determinism": {
    "atomic_ops": false,
    "claimed": "bit-exact-same-hw",
    "subgroup_ops": false
  },
  "payload": {
    "checksum": "sha256:0df87788c393d0fa2eb395f3be2c7e984bf0c2c130f3b5383a6beca836d2c70a",
    "format": "hdf5",
    "path": "phase-3-mass-spring-cloth.h5"
  },
  "run": {
    "capture_interval": 10,
    "start_utc": "2026-05-29T03:05:21Z",
    "step_count": 20,
    "wall_clock_seconds": 0.0
  },
  "schema_version": "1.0.0",
  "sim": {
    "category": "soft-body",
    "name": "mass-spring-cloth",
    "variant": "ref"
  },
  "stack": {
    "build_id": "stage-1b",
    "name": "cpp",
    "version": "0.0.0"
  }
}
