{
  "config": {
    "dims": [
      3,
      3
    ],
    "dtype": "f64",
    "params": {
      "dt": 0.05,
      "ic_jitter_scale": 1e-06,
      "n_agents": 3,
      "perception_radius": 5.0,
      "v_max": 3.0,
      "w_align": 1.0,
      "w_cohere": 1.0,
      "w_sep": 1.5
    },
    "seed": 42,
    "tier": "test"
  },
  "determinism": {
    "atomic_ops": false,
    "claimed": "bit-exact-same-hw",
    "subgroup_ops": false
  },
  "payload": {
    "checksum": "sha256:a0f8757a4dd913149b01c043f4f705e6ec3001cbaf7f54db42a2fd76440903c3",
    "format": "hdf5",
    "path": "flock-3agents-canonical-seed42-step1000.h5"
  },
  "run": {
    "capture_interval": 100,
    "start_utc": "2026-05-20T00:00:00Z",
    "step_count": 1000,
    "wall_clock_seconds": 0.024978421002742834
  },
  "schema_version": "1.0.0",
  "sim": {
    "category": "agent-based",
    "name": "boids-3d",
    "variant": "reynolds-1987-canonical"
  },
  "stack": {
    "build_id": "sub-phase-agent-based",
    "name": "numpy-reference",
    "version": "0.0.1"
  }
}
