{
  "config": {
    "dims": [
      128,
      128,
      128
    ],
    "dtype": "f64",
    "params": {
      "dt": 0.00125,
      "ic": "taylor-green-3d",
      "init_velocity_residual": 0.00010034538674541515,
      "poisson_vcycles": 4.0,
      "reinit_interval": 20.0
    },
    "seed": 42,
    "tier": "test"
  },
  "determinism": {
    "atomic_ops": false,
    "claimed": "bit-exact-same-hw",
    "subgroup_ops": false
  },
  "payload": {
    "checksum": "sha256:6e8e10e93da79bc4f3ae374605b0842db8155b2b8f056f672ab96b6ee2e79c75",
    "format": "hdf5",
    "path": "taylor-green-128cube-seed42-step500.h5"
  },
  "run": {
    "capture_interval": 50,
    "start_utc": "2026-06-20T20:44:36Z",
    "step_count": 500,
    "wall_clock_seconds": 0.0
  },
  "schema_version": "1.0.0",
  "sim": {
    "category": "volumetric-grid",
    "name": "eulerian-smoke",
    "variant": "frontier-edge"
  },
  "stack": {
    "build_id": "phase-6-c1-u6",
    "name": "cpp",
    "version": "0.0.0"
  }
}
