{
  "config": {
    "dims": [
      128,
      128,
      128
    ],
    "dtype": "f64",
    "params": {
      "blob_center": [
        0.5,
        0.5,
        0.65
      ],
      "blob_initial_vz": -2.0,
      "blob_radius": 0.15,
      "boundary": "sticky-floor-at-z-index-4-axis-clamp-walls",
      "constitutive": "neo-hookean-single-material",
      "descriptor": "drop-impact-128cube-seed42-step500",
      "dt": 0.0001,
      "floor_z_index": 4,
      "gravity_z": -9.81,
      "material_count": 1,
      "n_particles": 1000000,
      "poisson_ratio": 0.3,
      "shape_function": "quadratic-b-spline-3-node",
      "youngs_modulus": 4000.0
    },
    "seed": 42,
    "tier": "ref"
  },
  "determinism": {
    "atomic_ops": true,
    "claimed": "bit-exact-same-hw",
    "subgroup_ops": false
  },
  "payload": {
    "checksum": "sha256:dfc4d69957d54a494aad6369f464e4b267b8ddacf2dcae227ed92e2f4554d0a9",
    "format": "hdf5",
    "path": "drop-impact-128cube-seed42-step500.h5"
  },
  "run": {
    "capture_interval": 50,
    "start_utc": "2026-05-25T00:00:00Z",
    "step_count": 500,
    "wall_clock_seconds": 304.4922944449936
  },
  "schema_version": "1.0.0",
  "sim": {
    "category": "hybrid-pg",
    "name": "mpm-multimaterial",
    "variant": "mls-mpm-hu-2018-multimaterial"
  },
  "stack": {
    "build_id": "sub-phase-mpm-multimaterial-stack-e",
    "name": "warp-stack-e",
    "version": "0.1.0"
  }
}
