{
  "config": {
    "dims": [
      3
    ],
    "dtype": "f64",
    "params": {
      "a": 0.2,
      "b": -0.01,
      "c": 1.0,
      "d": -0.4,
      "dt": 0.01,
      "e": -1.0,
      "f": -1.0,
      "ic_jitter_scale": 1e-06
    },
    "seed": 42,
    "tier": "test"
  },
  "determinism": {
    "atomic_ops": false,
    "claimed": "bit-exact-same-hw",
    "subgroup_ops": false
  },
  "payload": {
    "checksum": "sha256:3aee64657a0b5337e73fddd603ca406c42e5ababf6eaf2bdcac60cd719c146c6",
    "format": "hdf5",
    "path": "fourwing-trajectory-seed42-step10000.h5"
  },
  "run": {
    "capture_interval": 1000,
    "start_utc": "2026-07-03T00:00:00Z",
    "step_count": 10000,
    "wall_clock_seconds": 0.09041805300148553
  },
  "schema_version": "1.0.0",
  "sim": {
    "category": "closed-form",
    "name": "strange-attractors",
    "variant": "fourwing"
  },
  "stack": {
    "build_id": "phase-6-xa-expansion",
    "name": "numpy-reference",
    "version": "0.0.1"
  }
}
